[
  {
    "name": "Simple Timers",
    "link": "",
    "date": "",
    "description": "A simple library for creating timers in Unity"
  },
  {
    "name": "Unity Advanced System",
    "link": "",
    "date": "",
    "description": "An advanced system to replace Unity's GameObject with a composition based architecture made of Controllers, Systems, and Workers"
  },
  {
    "name": "Game Systems Visualization in Phaser",
    "link": "https://assayyaad.itch.io/anthima-phaser",
    "date": "2024-06",
    "description": "Game Systems Visualization in Phaser is a project aimed at visualizing and developing game systems using the Phaser framework."
  },
  {
    "name": "TicTacToe With Odin & SDL2",
    "link": "https://assayyaad.itch.io/xo",
    "date": "2025-02",
    "description": "A simple Tic Tac Toe game developed using Odin and SDL2"
  },
  {
    "name": "Coin Effects Tools",
    "link": "https://assayyaad.itch.io/riyal-coin",
    "date": "2025-03",
    "description": "A set of tools for creating coin effects in games"
  },
  {
    "name": "Village Warriors",
    "link": "https://assayyaad.itch.io/village-warriors",
    "date": "2021-04",
    "description": "An RPG adventure game with a complex turn-based combat system"
  },
  {
    "name": "Grid Horror",
    "link": "https://assayyaad.itch.io/grid-horror",
    "date": "2025-02",
    "description": "A simple horror game with a procedurally generated grid map"
  },
  {
    "name": "Chicken Out",
    "link": "https://assayyaad.itch.io/chicken-out",
    "date": "2021-06",
    "description": "An online 4 players multiplayer fighting game with rock-paper-scissors guns and powerup items"
  }
]
