[
  {
    "name": "المؤقتات البسيطة",
    "link": "",
    "date": "",
    "description": "مكتبة بسيطة لإنشاء مؤقتات في Unity"
  },
  {
    "name": "نظام يونيتي المتقدم",
    "link": "",
    "date": "",
    "description": "نظام متقدم لاستبدال GameObject في يونيتي بنظام قائم على التركيب يتكون من متحكمات وأنظمة وعمال"
  },
  {
    "name": "تصور أنظمة الألعاب في فيزر",
    "link": "https://assayyaad.itch.io/anthima-phaser",
    "date": "2024-06",
    "description": "تصور أنظمة الألعاب في فيزر هو مشروع يهدف إلى تصور وتطوير أنظمة الألعاب باستخدام إطار عمل فيزر."
  },
  {
    "name": "الدائرة والتقاطع مع أودين وSDL2",
    "link": "https://assayyaad.itch.io/xo",
    "date": "2025-02",
    "description": "لعبة تيك تاك تو بسيطة تم تطويرها باستخدام أودين وSDL2"
  },
  {
    "name": "أدوات تأثيرات العملات",
    "link": "https://assayyaad.itch.io/riyal-coin",
    "date": "2025-03",
    "description": "مجموعة من الأدوات لإنشاء تأثيرات العملات في الألعاب"
  },
  {
    "name": "محاربو القرية",
    "link": "https://assayyaad.itch.io/village-warriors",
    "date": "2021-04",
    "description": "لعبة تقمص أدوار مغامرات مع نظام قتال معقد يعتمد على الأدوار"
  },
  {
    "name": "رعب الشبكة",
    "link": "https://assayyaad.itch.io/grid-horror",
    "date": "2025-02",
    "description": "لعبة رعب بسيطة مع خريطة شبكية تم إنشاؤها إجرائيًا."
  },
  {
    "name": "الدجاجة الهاربة",
    "link": "https://assayyaad.itch.io/chicken-out",
    "date": "2021-06",
    "description": "لعبة قتال متعددة اللاعبين عبر الإنترنت لـ 4 لاعبين مع أسلحة حجر-ورقة-مقص وعناصر تعزيز القوة"
  }
]
